{
  "updated_at": "2026-04-08T20:39:27+08:00",
  "source": "Tushare sw_daily + fina_indicator_vip + index_daily(000985.CSI) + broker_recommend + index_member + index_classify(SW2021)",
  "stale_after_minutes": 1440,
  "status": "ok",
  "status_message": "已接入 3 个市场跟踪栏目，0 个栏目保留占位，0 个栏目加载失败。",
  "board_id": "market-tracking",
  "title": "市场跟踪",
  "description": "市场跟踪板块用于补充消费相关行业 PB-ROE、拥挤度和券商金股中消费个股占比观察。",
  "sections": [
    {
      "section_id": "consumer-pb-roe",
      "title": "消费相关行业 PB-ROE 图",
      "description": "通过标签切换查看全部申万一级行业与消费相关申万二级行业的 PB-ROE 散点图。",
      "status": "ready",
      "charts": [
        {
          "chart_id": "consumer-pb-roe-l1",
          "title": "全部申万一级行业 PB-ROE 图",
          "description": "展示全部申万一级行业当前 PB 与 ROE 的五年历史分位，红点高亮消费相关行业。",
          "chart_type": "scatter",
          "x_axis_label": "PB五年分位数",
          "y_axis_label": "ROE五年分位数",
          "latest_label": "数据截至",
          "latest_time_text": "PB 2026-04-08 / ROE 2026-03-31",
          "points": [
            {
              "ts_code": "801170.SI",
              "industry_name": "交通运输",
              "level": "L1",
              "parent_l1_name": null,
              "pb_percentile_5y": 42.9,
              "roe_percentile_5y": 84.2,
              "latest_pb": 1.34,
              "latest_pb_date": "2026-04-08",
              "latest_roe": 5.51,
              "latest_roe_period": "2025-12-31",
              "is_consumer_related": false
            },
            {
              "ts_code": "801760.SI",
              "industry_name": "传媒",
              "level": "L1",
              "parent_l1_name": null,
              "pb_percentile_5y": 90.7,
              "roe_percentile_5y": 63.2,
              "latest_pb": 3.07,
              "latest_pb_date": "2026-04-08",
              "latest_roe": 2.04,
              "latest_roe_period": "2025-12-31",
              "is_consumer_related": false
            },
            {
              "ts_code": "801160.SI",
              "industry_name": "公用事业",
              "level": "L1",
              "parent_l1_name": null,
              "pb_percentile_5y": 79.5,
              "roe_percentile_5y": 100.0,
              "latest_pb": 1.7,
              "latest_pb_date": "2026-04-08",
              "latest_roe": 7.39,
              "latest_roe_period": "2025-12-31",
              "is_consumer_related": false
            },
            {
              "ts_code": "801010.SI",
              "industry_name": "农林牧渔",
              "level": "L1",
              "parent_l1_name": null,
              "pb_percentile_5y": 29.7,
              "roe_percentile_5y": 100.0,
              "latest_pb": 2.53,
              "latest_pb_date": "2026-04-08",
              "latest_roe": 5.25,
              "latest_roe_period": "2025-12-31",
              "is_consumer_related": true
            },
            {
              "ts_code": "801150.SI",
              "industry_name": "医药生物",
              "level": "L1",
              "parent_l1_name": null,
              "pb_percentile_5y": 36.4,
              "roe_percentile_5y": 75.0,
              "latest_pb": 2.77,
              "latest_pb_date": "2026-04-08",
              "latest_roe": 5.11,
              "latest_roe_period": "2026-03-31",
              "is_consumer_related": false
            },
            {
              "ts_code": "801200.SI",
              "industry_name": "商贸零售",
              "level": "L1",
              "parent_l1_name": null,
              "pb_percentile_5y": 60.2,
              "roe_percentile_5y": 5.0,
              "latest_pb": 1.94,
              "latest_pb_date": "2026-04-08",
              "latest_roe": -2.07,
              "latest_roe_period": "2026-03-31",
              "is_consumer_related": true
            },
            {
              "ts_code": "801740.SI",
              "industry_name": "国防军工",
              "level": "L1",
              "parent_l1_name": null,
              "pb_percentile_5y": 86.8,
              "roe_percentile_5y": 68.4,
              "latest_pb": 3.74,
              "latest_pb_date": "2026-04-08",
              "latest_roe": 2.42,
              "latest_roe_period": "2025-12-31",
              "is_consumer_related": false
            },
            {
              "ts_code": "801030.SI",
              "industry_name": "基础化工",
              "level": "L1",
              "parent_l1_name": null,
              "pb_percentile_5y": 67.7,
              "roe_percentile_5y": 63.2,
              "latest_pb": 2.49,
              "latest_pb_date": "2026-04-08",
              "latest_roe": 4.7,
              "latest_roe_period": "2025-12-31",
              "is_consumer_related": false
            },
            {
              "ts_code": "801110.SI",
              "industry_name": "家用电器",
              "level": "L1",
              "parent_l1_name": null,
              "pb_percentile_5y": 19.3,
              "roe_percentile_5y": 78.9,
              "latest_pb": 2.34,
              "latest_pb_date": "2026-04-08",
              "latest_roe": 8.37,
              "latest_roe_period": "2025-12-31",
              "is_consumer_related": true
            },
            {
              "ts_code": "801710.SI",
              "industry_name": "建筑材料",
              "level": "L1",
              "parent_l1_name": null,
              "pb_percentile_5y": 57.3,
              "roe_percentile_5y": 57.9,
              "latest_pb": 1.54,
              "latest_pb_date": "2026-04-08",
              "latest_roe": 2.09,
              "latest_roe_period": "2025-12-31",
              "is_consumer_related": false
            },
            {
              "ts_code": "801720.SI",
              "industry_name": "建筑装饰",
              "level": "L1",
              "parent_l1_name": null,
              "pb_percentile_5y": 64.3,
              "roe_percentile_5y": 84.2,
              "latest_pb": 0.87,
              "latest_pb_date": "2026-04-08",
              "latest_roe": 4.35,
              "latest_roe_period": "2025-12-31",
              "is_consumer_related": false
            },
            {
              "ts_code": "801180.SI",
              "industry_name": "房地产",
              "level": "L1",
              "parent_l1_name": null,
              "pb_percentile_5y": 43.8,
              "roe_percentile_5y": 21.1,
              "latest_pb": 0.81,
              "latest_pb_date": "2026-04-08",
              "latest_roe": -0.18,
              "latest_roe_period": "2025-12-31",
              "is_consumer_related": false
            },
            {
              "ts_code": "801050.SI",
              "industry_name": "有色金属",
              "level": "L1",
              "parent_l1_name": null,
              "pb_percentile_5y": 93.0,
              "roe_percentile_5y": 100.0,
              "latest_pb": 3.8,
              "latest_pb_date": "2026-04-08",
              "latest_roe": 11.15,
              "latest_roe_period": "2025-12-31",
              "is_consumer_related": false
            },
            {
              "ts_code": "801890.SI",
              "industry_name": "机械设备",
              "level": "L1",
              "parent_l1_name": null,
              "pb_percentile_5y": 96.5,
              "roe_percentile_5y": 84.2,
              "latest_pb": 3.29,
              "latest_pb_date": "2026-04-08",
              "latest_roe": 5.15,
              "latest_roe_period": "2025-12-31",
              "is_consumer_related": false
            },
            {
              "ts_code": "801880.SI",
              "industry_name": "汽车",
              "level": "L1",
              "parent_l1_name": null,
              "pb_percentile_5y": 76.7,
              "roe_percentile_5y": 100.0,
              "latest_pb": 2.56,
              "latest_pb_date": "2026-04-08",
              "latest_roe": 7.26,
              "latest_roe_period": "2025-12-31",
              "is_consumer_related": false
            },
            {
              "ts_code": "801950.SI",
              "industry_name": "煤炭",
              "level": "L1",
              "parent_l1_name": null,
              "pb_percentile_5y": 75.8,
              "roe_percentile_5y": 26.3,
              "latest_pb": 1.49,
              "latest_pb_date": "2026-04-08",
              "latest_roe": 3.23,
              "latest_roe_period": "2025-12-31",
              "is_consumer_related": false
            },
            {
              "ts_code": "801970.SI",
              "industry_name": "环保",
              "level": "L1",
              "parent_l1_name": null,
              "pb_percentile_5y": 83.3,
              "roe_percentile_5y": 94.7,
              "latest_pb": 1.78,
              "latest_pb_date": "2026-04-08",
              "latest_roe": 6.46,
              "latest_roe_period": "2025-12-31",
              "is_consumer_related": false
            },
            {
              "ts_code": "801730.SI",
              "industry_name": "电力设备",
              "level": "L1",
              "parent_l1_name": null,
              "pb_percentile_5y": 53.2,
              "roe_percentile_5y": 78.9,
              "latest_pb": 3.43,
              "latest_pb_date": "2026-04-08",
              "latest_roe": 5.63,
              "latest_roe_period": "2025-12-31",
              "is_consumer_related": false
            },
            {
              "ts_code": "801080.SI",
              "industry_name": "电子",
              "level": "L1",
              "parent_l1_name": null,
              "pb_percentile_5y": 95.7,
              "roe_percentile_5y": 45.0,
              "latest_pb": 5.25,
              "latest_pb_date": "2026-04-08",
              "latest_roe": 2.6,
              "latest_roe_period": "2026-03-31",
              "is_consumer_related": false
            },
            {
              "ts_code": "801960.SI",
              "industry_name": "石油石化",
              "level": "L1",
              "parent_l1_name": null,
              "pb_percentile_5y": 83.6,
              "roe_percentile_5y": 94.7,
              "latest_pb": 1.6,